id,Name,Description,Wallet,fid
1,bianc8,"Hey there! I'm Bianc8, a Web3 fullstack developer at Builders Garden. I’m passionate about creating decentralized applications that empower communities and foster innovation in the blockchain space. Every line of code I write is aimed at building solutions that make a real difference. If you choose to support me, you’ll be helping to fund projects that enhance accessibility and collaboration in Web3. Together, we can shape the future of technology!",0xf66c00759467c6524b0c86af132bb52786b37382,189636
2,leal.eth,"Hello, I’m Leal.eth! As the co-founder of Talent, I’m all about redefining how we connect and collaborate in the professional world. I’m also building Builderfi and diving deep into various community projects. Besides that, I’m an adult chess improver, and I believe in the power of strategic thinking. Your support will enable me to continue pushing forward innovative solutions that open up new opportunities for creators and developers alike. Join me on this journey!",0x33041027dd8f4dc82b6e825fb37adf8f15d44053,195255
3,limone.eth,"Hi there! I’m Limone.eth, your friendly neighborhood lemon! I’m on a mission to build on-chain products and vibrant communities with Builders Garden. I love creating projects like Urbe-Eth and Ethrome, where creativity and collaboration come to life. By supporting me, you’re helping to nurture decentralized spaces where everyone can thrive and grow. Let’s spread some zest in the Web3 world together!",0x1358155a15930f89ebc787a34eb4ccfd9720bc62,4461
4,guy-do-or-die,"Hey! I’m Guy-Do-Or-Die. As a seasoned developer specializing in Python and JavaScript, I’m all about creating engaging on-chain experiences. I’m also a proud ambassador for Layer3, and I find joy in music, literature, and connecting with fellow enthusiasts. Your support will empower me to keep building tools that enrich user experiences in the blockchain space. Let’s make an impact together—one project at a time!",0x830bc5551e429ddbc4e9ac78436f8bf13eca8434,321301
5,juliomcruz,"Hi! I’m Juliomcruz, and I’m passionate about building solutions for communities. I believe in the power of collaboration and innovation to create meaningful change. My work focuses on understanding the needs of the people and developing tools that empower individuals and organizations alike. By donating to my cause, you’re helping me enhance the quality of life for countless individuals and foster a more inclusive environment. Let’s make a difference together!",0xc2564e41b7f5cb66d2d99466450cfebce9e8228f,210671
6,juampi,"Hello! I’m Juampi. I’m deeply involved in building at Talent and Builderfi, where I focus on creating solutions that enhance community engagement. My goal is to develop a thriving ecosystem where ideas flourish and people can connect in meaningful ways. If you choose to support my work, you’re investing in a future where innovation and collaboration are at the forefront. Let’s shape the future of technology together!",0xa081e1da16133bb4ebc7aab1a9b0588a48d15138,6730
7,Tamrat,"Hey! I’m Tamrat, an on-chain creator making waves at F.inc. I’m dedicated to developing innovative solutions that bridge gaps within the community and inspire creativity. My work aims to foster collaboration among like-minded individuals who are passionate about blockchain technology. Your support will enable me to amplify my impact and drive initiatives that empower others in this space. Together, we can create a more connected and vibrant future!",0x00000000000000000000000000000000000000000,21093
